,ID,Product Name,Description,Product Tags,Platform,combined_text
0,1,Shopify,An ecommerce platform that allows you to create and manage an online store. Great for setting up a pet food store.,"ecommerce, online store, pet food",Ruby on Rails,"shopify an ecommerce platform that allows you to create and manage an online store great for setting up a pet food store ecommerce, online store, pet food ruby on rails"
1,2,Magento,A powerful ecommerce solution with a lot of customization options. Ideal for a pet food shop with extensive product catalogs.,"ecommerce, customizable, pet food",PHP,"magento a powerful ecommerce solution with a lot of customization options ideal for a pet food shop with extensive product catalogs ecommerce, customizable, pet food php"
2,3,WooCommerce,A WordPress plugin that turns your site into a full-featured ecommerce store. Perfect for selling pet food.,"ecommerce, WordPress, pet food",WordPress,"woocommerce a wordpress plugin that turns your site into a fullfeatured ecommerce store perfect for selling pet food ecommerce, wordpress, pet food wordpress"
3,4,PrestaShop,An open-source ecommerce platform with a wide range of features. Good for creating a pet food shop.,"ecommerce, open-source, pet food",PHP,"prestashop an opensource ecommerce platform with a wide range of features good for creating a pet food shop ecommerce, opensource, pet food php"
4,5,BigCommerce,A cloud-based ecommerce solution for building and managing online stores. Suitable for a pet food store.,"ecommerce, cloud-based, pet food",SaaS,"bigcommerce a cloudbased ecommerce solution for building and managing online stores suitable for a pet food store ecommerce, cloudbased, pet food saas"
5,6,Drupal Commerce,An ecommerce module for Drupal that provides advanced features for online stores. Ideal for pet food ecommerce.,"ecommerce, Drupal, pet food",Drupal,"drupal commerce an ecommerce module for drupal that provides advanced features for online stores ideal for pet food ecommerce ecommerce, drupal, pet food drupal"
6,7,Joomla VirtueMart,An ecommerce extension for Joomla that allows you to set up an online store. Useful for a pet food shop.,"ecommerce, Joomla, pet food",Joomla,"joomla virtuemart an ecommerce extension for joomla that allows you to set up an online store useful for a pet food shop ecommerce, joomla, pet food joomla"
7,8,osCommerce,An open-source ecommerce solution with a large user base. Good for setting up a pet food store.,"ecommerce, open-source, pet food",PHP,"oscommerce an opensource ecommerce solution with a large user base good for setting up a pet food store ecommerce, opensource, pet food php"
8,9,OpenCart,A user-friendly open-source ecommerce platform that supports various store types. Great for a pet food shop.,"ecommerce, open-source, pet food",PHP,"opencart a userfriendly opensource ecommerce platform that supports various store types great for a pet food shop ecommerce, opensource, pet food php"
9,10,Zencart,An open-source ecommerce shopping cart system that offers many features for online stores. Suitable for pet food sales.,"ecommerce, open-source, pet food",PHP,"zencart an opensource ecommerce shopping cart system that offers many features for online stores suitable for pet food sales ecommerce, opensource, pet food php"
10,11,Wix,A cloud-based website builder with ecommerce functionality. Ideal for small to medium-sized pet food stores.,"website builder, ecommerce, cloud-based",SaaS,"wix a cloudbased website builder with ecommerce functionality ideal for small to mediumsized pet food stores website builder, ecommerce, cloudbased saas"
11,12,Squarespace,A website builder with integrated ecommerce tools. Suitable for creating and managing an online pet food store.,"website builder, ecommerce, customizable",SaaS,"squarespace a website builder with integrated ecommerce tools suitable for creating and managing an online pet food store website builder, ecommerce, customizable saas"
12,13,Weebly,A website builder with ecommerce capabilities. Good for setting up a pet food store with ease.,"website builder, ecommerce, user-friendly",SaaS,"weebly a website builder with ecommerce capabilities good for setting up a pet food store with ease website builder, ecommerce, userfriendly saas"
13,14,Odoo,An open-source suite of business applications including ecommerce. Great for a pet food store with additional business management features.,"ecommerce, open-source, business management",Python,"odoo an opensource suite of business applications including ecommerce great for a pet food store with additional business management features ecommerce, opensource, business management python"
14,15,ECWid,A versatile ecommerce platform that integrates with any website. Ideal for adding a pet food store to an existing site.,"ecommerce, integration, versatile",JavaScript,"ecwid a versatile ecommerce platform that integrates with any website ideal for adding a pet food store to an existing site ecommerce, integration, versatile javascript"
15,16,VirtueMart,"An ecommerce solution for Joomla, offering flexibility and customization for pet food stores.","ecommerce, Joomla, flexible",Joomla,"virtuemart an ecommerce solution for joomla, offering flexibility and customization for pet food stores ecommerce, joomla, flexible joomla"
16,17,Spree Commerce,"An open-source ecommerce platform built with Ruby on Rails, offering customization and scalability.","ecommerce, open-source, scalable",Ruby on Rails,"spree commerce an opensource ecommerce platform built with ruby on rails, offering customization and scalability ecommerce, opensource, scalable ruby on rails"
17,18,Solidus,"A flexible, open-source ecommerce platform built with Ruby on Rails, designed for high-performance online stores.","ecommerce, open-source, high-performance",Ruby on Rails,"solidus a flexible, opensource ecommerce platform built with ruby on rails, designed for highperformance online stores ecommerce, opensource, highperformance ruby on rails"
18,19,Reaction Commerce,"An open-source, real-time commerce platform built with Node.js and MongoDB, suitable for modern ecommerce needs.","ecommerce, real-time, open-source",Node.js,"reaction commerce an opensource, realtime commerce platform built with nodejs and mongodb, suitable for modern ecommerce needs ecommerce, realtime, opensource nodejs"
19,20,Gatsby,"A modern site generator that can be used with ecommerce plugins to create a fast, static online store for pet food.","static site, ecommerce, modern",JavaScript,"gatsby a modern site generator that can be used with ecommerce plugins to create a fast, static online store for pet food static site, ecommerce, modern javascript"
20,21,Commerce Cloud,A cloud-based ecommerce platform from Salesforce with extensive customization and integration capabilities.,"ecommerce, cloud-based, Salesforce",SaaS,"commerce cloud a cloudbased ecommerce platform from salesforce with extensive customization and integration capabilities ecommerce, cloudbased, salesforce saas"
21,22,3dcart,An all-in-one ecommerce platform with a range of features for creating and managing online stores.,"ecommerce, all-in-one, features",SaaS,"3dcart an allinone ecommerce platform with a range of features for creating and managing online stores ecommerce, allinone, features saas"
22,23,NopCommerce,An open-source ecommerce solution with a wide range of features and a flexible design.,"ecommerce, open-source, flexible",ASP.NET,"nopcommerce an opensource ecommerce solution with a wide range of features and a flexible design ecommerce, opensource, flexible aspnet"
23,24,Jigoshop,A WordPress plugin for ecommerce that offers a range of features for managing online stores.,"ecommerce, WordPress, plugin",WordPress,"jigoshop a wordpress plugin for ecommerce that offers a range of features for managing online stores ecommerce, wordpress, plugin wordpress"
24,25,AbanteCart,An open-source ecommerce solution with a variety of features and extensions.,"ecommerce, open-source, extensions",PHP,"abantecart an opensource ecommerce solution with a variety of features and extensions ecommerce, opensource, extensions php"
25,26,OpenWebAnalytics,An open-source web analytics platform that can be integrated with ecommerce stores for tracking and analysis.,"analytics, open-source, integration",PHP,"openwebanalytics an opensource web analytics platform that can be integrated with ecommerce stores for tracking and analysis analytics, opensource, integration php"
26,27,Kibo Commerce,A cloud-based ecommerce platform offering personalized experiences and comprehensive management tools.,"ecommerce, cloud-based, personalized",SaaS,"kibo commerce a cloudbased ecommerce platform offering personalized experiences and comprehensive management tools ecommerce, cloudbased, personalized saas"
27,28,Nexcess,"A hosting provider offering specialized services for ecommerce websites, including optimized performance.","hosting, ecommerce, performance",SaaS,"nexcess a hosting provider offering specialized services for ecommerce websites, including optimized performance hosting, ecommerce, performance saas"
28,29,X-Cart,"A flexible, open-source ecommerce platform with a range of features and customization options.","ecommerce, open-source, flexible",PHP,"xcart a flexible, opensource ecommerce platform with a range of features and customization options ecommerce, opensource, flexible php"
29,30,ZenCart,"A user-friendly, open-source ecommerce shopping cart system with extensive features.","ecommerce, open-source, user-friendly",PHP,"zencart a userfriendly, opensource ecommerce shopping cart system with extensive features ecommerce, opensource, userfriendly php"
